<!ELEMENT LABELS (LABEL+)>
<!ELEMENT LABEL (NAME, MAINOFFICE, WEB)>
<!ELEMENT NAME (#PCDATA)>
<!ELEMENT MAINOFFICE (#PCDATA)>
<!ELEMENT WEB (#PCDATA)>
